url,name,address,city,state,phone
http://www.desmetbiggs.com/,Results,"ÓÉą322 Mt Rushmore Rd, Custer, SD 57730",Custer,SD,Óāį(605) 673-2707
http://www.lepperaccounting.com/,Results,"ÓÉą9540 Chilson Commons Cir, Pinckney, MI 48169",Pinckney,MI,Óāį(810) 355-1552
https://m.facebook.com/cardinalrestaurant22/,Results,"ÓÉą2391 US-10, Custer, MI 49405",Custer,MI,Óāį(231) 936-1178
https://splinternetmarketing.com/local-pros/mi/irons/page-accounting-tax-services/,Page Accounting & Tax Services,"ÓÉą5577 W 10 1/2 Mile Rd, Irons, MI 49644",Irons,MI,Óāį(231) 266-5317
https://www.wmicpa.com/,Schuhardt & Chamberlain,"ÓÉą975 Spaulding Ave SE a, Ada, MI 49301",Ada,MI,Óāį(616) 956-7979
http://accountingfortoday.com/,West Coast CPA Group,"ÓÉą301 Hoover Blvd #100, Holland, MI 49423",Holland,MI,Óāį(616) 994-6500
https://www.barryassoc.com/,"Barry Associates, Inc.","ÓÉą8653 N 32nd St #1a, Richland, MI 49083",Richland,MI,Óāį(269) 629-4436
https://www.raymondking.cpa/,Raymond & King CPAs PLLC,"ÓÉą3064 Main St, Marlette, MI 48453",Marlette,MI,Óāį(989) 635-3113
http://www.hewitt-tax.com/,Hewitt Tax & Accounting LLC,"ÓÉą2111 Golfside Rd STE 10, Ypsilanti, MI 48197",Ypsilanti,MI,Óāį(734) 796-7788
http://collins1040.com/,Collins Accounting & Tax Service,"ÓÉą3352 Dean Rd, Lambertville, MI 48144",Lambertville,MI,Óāį(734) 854-2926
https://lewistaxaccounting.com/,Lewis Tax Accounting Inc,"ÓÉą35103 Silvano St, Clinton Township, MI 48035",Clinton Township,MI,Óāį(586) 463-1040
http://www.rpccpas.com/,"Roslund Prestage & Company, PC","ÓÉą525 Warwick Dr Ste A, Alma, MI 48801",Alma,MI,Óāį(989) 463-6123
https://www.hyzerhillkuzak.com/,Hyzer Hill Kuzak & Co PC,"ÓÉą1242 Sand Beach Rd, Bad Axe, MI 48413",Bad Axe,MI,Óāį(989) 269-9541
http://www.danbosler.com/,Affordable Accounting Assistance,"ÓÉą2446 Baldwin Rd, Fenton, MI 48430",Fenton,MI,Óāį(810) 629-0845
http://www.custerfinancialadvisors.com/,Custer Financial Advisors,"ÓÉą1 Royal Park Dr #5, Zeeland, MI 49464",Zeeland,MI,Óāį(616) 748-4919
https://tax-cafe.net/index.html,The Tax Cafe,"ÓÉą132 Ashman Cir, Midland, MI 48640",Midland,MI,Óāį(989) 898-7098
https://kcstax.com/,KC‚Äôs Tax & Accounting LLC,"ÓÉą105 E 2nd St Unit o, Davison, MI 48423",Davison,MI,Óāį(810) 652-6125
http://www.aspiretaxaccounting.com/,Aspire Tax & Accounting,"ÓÉą7433 Jackman Rd, Temperance, MI 48182",Temperance,MI,Óāį(734) 854-2513
